{"schema_version":"1.0","package_version":"1.0.0","applies_to":"TLC-FC-29-GENERATIONAL-PROPAGATION-009","tests":[{"test_id":"GP009-A01","applies_to":"TLC-FC-29-GENERATIONAL-PROPAGATION-009","category":"preservation","given":"an explicitly finite nonempty supplied invariant core with every delta_x_max nonzero","when":"Q_rep is evaluated","expect":"the exact finite-cardinality sum is used with exp(-lambda t) retained and no measure, integration, Monte Carlo, or epsilon repair","source_basis":["registry/test-plans/TLC-FC-29-GENERATIONAL-PROPAGATION-009/test-plan.yaml"]}]}