{"schema_version":"1.0","package_version":"1.0.0","applies_to":"TLC-FC-21-FAIRNESS-008","tests":[{"test_id":"FAIR-008-A01","applies_to":"TLC-FC-21-FAIRNESS-008","category":"preservation","given":"the source objective","when":"the descriptor is emitted","expect":"the plus entropy term and other source terms are unchanged","source_basis":["registry/test-plans/TLC-FC-21-FAIRNESS-008/test-plan.yaml"]},{"test_id":"FAIR-008-A02","applies_to":"TLC-FC-21-FAIRNESS-008","category":"unsupported_operation","given":"no candidate-space or argmax provider","when":"a selected y is requested","expect":"no search candidate fabrication or entropy-sign repair is performed","source_basis":["registry/test-plans/TLC-FC-21-FAIRNESS-008/test-plan.yaml"]}]}
