{
  "schema_version": "1.0",
  "package_version": "1.0.0",
  "applies_to": "TLC-FC-15-RELATIONS-007",
  "tests": [
    {
      "test_id": "TLC-FC-15-RELATIONS-007-AT-001",
      "applies_to": "BUILD-RELATIONS-007-RECORD",
      "category": "valid_input",
      "given": "Exact identity, exact ordered participants, preserved opaque values, scope, context, and all unresolved items.",
      "when": "The structural record operation is invoked.",
      "expect": "A deterministic guarded record is returned with 5 participants and 12 unresolved items.",
      "source_basis": [
        "registry/oracles/relations/TLC-FC-15-RELATIONS-007/oracle.yaml"
      ]
    },
    {
      "test_id": "TLC-FC-15-RELATIONS-007-AT-002",
      "applies_to": "BUILD-RELATIONS-007-RECORD",
      "category": "invalid_input",
      "given": "A mismatched feature identity.",
      "when": "Validation runs.",
      "expect": "FeatureIdentityMismatch and no partial record.",
      "source_basis": [
        "registry/oracles/relations/TLC-FC-15-RELATIONS-007/oracle.yaml"
      ]
    },
    {
      "test_id": "TLC-FC-15-RELATIONS-007-AT-003",
      "applies_to": "BUILD-RELATIONS-007-RECORD",
      "category": "preservation",
      "given": "A participant is missing, extra, duplicated, or reordered.",
      "when": "Participant validation runs.",
      "expect": "The corresponding authoritative participant error and no partial record.",
      "source_basis": [
        "registry/oracles/relations/TLC-FC-15-RELATIONS-007/oracle.yaml"
      ]
    },
    {
      "test_id": "TLC-FC-15-RELATIONS-007-AT-004",
      "applies_to": "BUILD-RELATIONS-007-RECORD",
      "category": "preservation",
      "given": "Opaque values, scope, context, or source references are altered.",
      "when": "Preservation validation runs.",
      "expect": "The corresponding preservation error and no partial record.",
      "source_basis": [
        "registry/oracles/relations/TLC-FC-15-RELATIONS-007/oracle.yaml"
      ]
    },
    {
      "test_id": "TLC-FC-15-RELATIONS-007-AT-005",
      "applies_to": "BUILD-RELATIONS-007-RECORD",
      "category": "unsupported_operation",
      "given": "A scientific evaluation, composition, inversion, projection, membership, graph, numeric, temporal, or causal operation is requested.",
      "when": "The non-execution guard runs.",
      "expect": "ExternalRelationEvaluatorRequired and no scientific output.",
      "source_basis": [
        "registry/oracles/relations/TLC-FC-15-RELATIONS-007/oracle.yaml"
      ]
    },
    {
      "test_id": "TLC-FC-15-RELATIONS-007-AT-006",
      "applies_to": "BUILD-RELATIONS-007-RECORD",
      "category": "invariant",
      "given": "An endpoint, direction, runtime arity, relation property, type, dimension, or causal meaning is inferred.",
      "when": "The record is validated.",
      "expect": "ScientificPropertyInvented and no partial record.",
      "source_basis": [
        "registry/oracles/relations/TLC-FC-15-RELATIONS-007/oracle.yaml"
      ]
    },
    {
      "test_id": "TLC-FC-15-RELATIONS-007-AT-007",
      "applies_to": "BUILD-RELATIONS-007-RECORD",
      "category": "determinism",
      "given": "Byte-equivalent valid structural inputs are supplied repeatedly.",
      "when": "Construction is repeated.",
      "expect": "Structurally identical outputs with identical participant and unresolved ordering.",
      "source_basis": [
        "registry/oracles/relations/TLC-FC-15-RELATIONS-007/oracle.yaml"
      ]
    },
    {
      "test_id": "TLC-FC-15-RELATIONS-007-AT-008",
      "applies_to": "BUILD-RELATIONS-007-RECORD",
      "category": "preservation",
      "given": "One of the 12 unresolved items is removed, altered, or defaulted.",
      "when": "Unresolved propagation is validated.",
      "expect": "UnresolvedPropagationLoss and no partial record.",
      "source_basis": [
        "registry/oracles/relations/TLC-FC-15-RELATIONS-007/oracle.yaml"
      ]
    },
    {
      "test_id": "TLC-FC-15-RELATIONS-007-AT-009",
      "applies_to": "BUILD-RELATIONS-007-RECORD",
      "category": "unsupported_operation",
      "given": "Endpoint identity is inferred from a name or participant position.",
      "when": "Endpoint constraints are validated.",
      "expect": "EndpointInferenceProhibited and no endpoint-bearing result.",
      "source_basis": [
        "registry/oracles/relations/TLC-FC-15-RELATIONS-007/oracle.yaml"
      ]
    }
  ]
}
