{"schema_version":"1.0","package_version":"1.0.0","applies_to":"TLC-FC-11-CAPACITIES-007","tests":[{"test_id":"CAP-007-NOMINAL","applies_to":"CONSTRUCT-HAMILTONIAN-CAPACITY-DYNAMICS-AST","category":"valid_input","given":{"object_id":"TLC-SO-CAPACITIES-098","complete_inputs":true},"when":"The operation is invoked.","expect":{"artifact_kind":"CapacityHamiltonianAst","structurally_valid":true},"source_basis":["registry/oracles/capacities/TLC-FC-11-CAPACITIES-007/oracle.yaml"]},{"test_id":"CAP-007-SOURCE-LABELS","applies_to":"CONSTRUCT-HAMILTONIAN-CAPACITY-DYNAMICS-AST","category":"preservation","given":{"source_backed_labels_present":true},"when":"The AST is inspected.","expect":{"only_source_backed_labels_exposed":true},"source_basis":["registry/oracles/capacities/TLC-FC-11-CAPACITIES-007/oracle.yaml"]},{"test_id":"CAP-007-NO-INVENTED-LABEL","applies_to":"CONSTRUCT-HAMILTONIAN-CAPACITY-DYNAMICS-AST","category":"invariant","given":{"label_absent_from_source":true},"when":"The AST is inspected.","expect":{"absent_label_not_generated":true},"source_basis":["registry/test-plans/TLC-FC-11-CAPACITIES-007/test-plan.yaml"]},{"test_id":"CAP-007-BLOCKER","applies_to":"CONSTRUCT-HAMILTONIAN-CAPACITY-DYNAMICS-AST","category":"preservation","given":{"valid_inputs":true},"when":"The result is inspected.","expect":{"unresolved":["scientific decision required"]},"source_basis":["registry/oracles/capacities/TLC-FC-11-CAPACITIES-007/oracle.yaml"]},{"test_id":"CAP-007-NO-EXECUTION","applies_to":"CONSTRUCT-HAMILTONIAN-CAPACITY-DYNAMICS-AST","category":"unsupported_operation","given":{"hamiltonian_evaluation_requested":true},"when":"The request is validated.","expect":{"error":"ScientificEvaluationRequested","partial_result":false},"source_basis":["registry/oracles/capacities/TLC-FC-11-CAPACITIES-007/oracle.yaml"]},{"test_id":"CAP-007-DETERMINISM","applies_to":"CONSTRUCT-HAMILTONIAN-CAPACITY-DYNAMICS-AST","category":"determinism","given":{"identical_inputs":true},"when":"The operation is repeated.","expect":{"structurally_identical_outputs":true},"source_basis":["registry/algorithms/capacities/TLC-FC-11-CAPACITIES-007/algorithm.yaml"]}]}
