{"schema_version":"1.0","package_version":"1.0.0","applies_to":"TLC-FC-30-EXPANSION-015","tests":[{"test_id":"EXP030015-A01","applies_to":"TLC-FC-30-EXPANSION-015","category":"preservation","given":"the authoritative Expansion source and declared provider inputs","when":"the feature contract is evaluated","expect":"Keep domain-29 generational R distinct from domain-30 source-local resistance R_resistance; never alias, substitute, compare, or merge them.","source_basis":["registry/test-plans/TLC-FC-30-EXPANSION-015/test-plan.yaml"]},{"test_id":"EXP030015-A02","applies_to":"TLC-FC-30-EXPANSION-015","category":"error","given":"a request that requires science not defined by the source","when":"an implementation would otherwise fabricate the missing rule","expect":"the unresolved or external-provider boundary is preserved instead of inventing semantics","source_basis":["registry/oracles/expansion/TLC-FC-30-EXPANSION-015/oracle.yaml"]}]}