{"schema_version":"1.0","package_version":"1.0.0","applies_to":"TLC-FC-09-VALUES-014","tests":[{"test_id":"VALUES-014-NOMINAL","applies_to":"COMPOSE-MEMORY-INTEGRATION-OPERATOR-DESCRIPTORS","category":"valid_input","given":{"memory_stage":true,"integration_stage":true},"when":"The composition operation is invoked.","expect":{"output":"MemoryIntegrationOperatorPipeline","stage_order":["memory_stage","integration_stage"],"executed":false},"source_basis":["registry/test-plans/TLC-FC-09-VALUES-014/test-plan.yaml","registry/oracles/values/TLC-FC-09-VALUES-014/oracle.yaml"]},{"test_id":"VALUES-014-MISSING-MEMORY","applies_to":"COMPOSE-MEMORY-INTEGRATION-OPERATOR-DESCRIPTORS","category":"error","given":{"missing_memory_stage":true},"when":"Inputs are validated.","expect":{"source_error_id":"missing_memory_stage","public_error_code":"VALUES_MISSING_MEMORY_STAGE","partial_result":false},"source_basis":["registry/math-contracts/TLC-FC-09-VALUES-014/contract.yaml"]},{"test_id":"VALUES-014-MISSING-INTEGRATION","applies_to":"COMPOSE-MEMORY-INTEGRATION-OPERATOR-DESCRIPTORS","category":"error","given":{"missing_integration_stage":true},"when":"Inputs are validated.","expect":{"source_error_id":"missing_integration_stage","public_error_code":"VALUES_MISSING_INTEGRATION_STAGE","partial_result":false},"source_basis":["registry/math-contracts/TLC-FC-09-VALUES-014/contract.yaml"]},{"test_id":"VALUES-014-ORDER-ERROR","applies_to":"COMPOSE-MEMORY-INTEGRATION-OPERATOR-DESCRIPTORS","category":"error","given":{"proposed_order":["integration_stage","memory_stage"]},"when":"Observable stage order is validated.","expect":{"source_error_id":"invalid_stage_order","public_error_code":"VALUES_INVALID_STAGE_ORDER","partial_result":false},"source_basis":["registry/math-contracts/TLC-FC-09-VALUES-014/contract.yaml"]},{"test_id":"VALUES-014-ORDER-PRESERVATION","applies_to":"COMPOSE-MEMORY-INTEGRATION-OPERATOR-DESCRIPTORS","category":"preservation","given":{"opaque_stage_tokens":true},"when":"The pipeline is inspected.","expect":{"stage_order":["memory_stage","integration_stage"],"identities_distinct":true,"tokens_unchanged":true},"source_basis":["registry/oracles/values/TLC-FC-09-VALUES-014/oracle.yaml"]},{"test_id":"VALUES-014-UNRESOLVED","applies_to":"COMPOSE-MEMORY-INTEGRATION-OPERATOR-DESCRIPTORS","category":"preservation","given":{"source_unresolved":["memory_model","integration_semantics","stage_signatures"]},"when":"The pipeline is inspected.","expect":{"exact_unresolved_preserved":true,"assumption":"TLC-EA-TLC-FC-09-VALUES-014-001"},"source_basis":["registry/test-plans/TLC-FC-09-VALUES-014/test-plan.yaml"]},{"test_id":"VALUES-014-DETERMINISM","applies_to":"COMPOSE-MEMORY-INTEGRATION-OPERATOR-DESCRIPTORS","category":"determinism","given":{"identical_inputs":true},"when":"Composition is repeated.","expect":{"structurally_identical_outputs":true},"source_basis":["registry/oracles/values/TLC-FC-09-VALUES-014/oracle.yaml"]},{"test_id":"VALUES-014-EXTERNAL","applies_to":"COMPOSE-MEMORY-INTEGRATION-OPERATOR-DESCRIPTORS","category":"unsupported_operation","given":{"stage_execution_without_provider":true},"when":"Execution is requested.","expect":{"supported":false,"aggregation_invented":false},"source_basis":["registry/oracles/values/TLC-FC-09-VALUES-014/oracle.yaml"]}]}