{"schema_version":"1.0","package_version":"1.0.0","applies_to":"TLC-FC-17-CASCADE-TRANSMISSION-033","tests":[{"test_id":"CAS017033-A01","applies_to":"TLC-FC-17-CASCADE-TRANSMISSION-033","category":"preservation","given":"the authoritative Cascade Transmission source and any explicitly declared provider inputs","when":"the feature contract is evaluated","expect":"Preserve the E_adapt(t) set definition and strict inequalities with provider boundaries.","source_basis":["registry/test-plans/TLC-FC-17-CASCADE-TRANSMISSION-033/test-plan.yaml"]},{"test_id":"CAS017033-A02","applies_to":"TLC-FC-17-CASCADE-TRANSMISSION-033","category":"error","given":"a request that relies on absent providers, unresolved conventions, or invented science","when":"an implementation would otherwise fabricate the missing rule","expect":"Do not invent delta_adapt, distance-to-set semantics, J or derivative construction.","source_basis":["registry/oracles/cascade-transmission/TLC-FC-17-CASCADE-TRANSMISSION-033/oracle.yaml"]}]}
