{"schema_version":"1.0","package_version":"1.0.0","applies_to":"TLC-FC-35-FIDELITY-TO-INVARIANT-CORE-005","tests":[{"test_id":"FID005-A01","applies_to":"TLC-FC-35-FIDELITY-TO-INVARIANT-CORE-005","category":"preservation","given":"supplied Sigma","when":"the distribution is described","expect":"Normal(0,Sigma) exactly","source_basis":["registry/test-plans/TLC-FC-35-FIDELITY-TO-INVARIANT-CORE-005/test-plan.yaml"]},{"test_id":"FID005-A02","applies_to":"TLC-FC-35-FIDELITY-TO-INVARIANT-CORE-005","category":"unsupported_operation","given":"a request to sample epsilon_n","when":"the request is evaluated","expect":"RandomSamplerProviderRequired","source_basis":["registry/test-plans/TLC-FC-35-FIDELITY-TO-INVARIANT-CORE-005/test-plan.yaml"]}]}
