{"schema_version":"1.0","package_version":"1.0.0","applies_to":"TLC-FC-23-MEMORY-008","tests":[{"test_id":"TLC-FC-23-MEMORY-008-AT-001","applies_to":"ASSESS-MEMORY-008","category":"output_contract","given":"The source assumptions bound and reservations.","when":"Structural assessment runs.","expect":"All are preserved without a stability truth value.","source_basis":["registry/oracles/memory/TLC-FC-23-MEMORY-008/oracle.yaml"]},{"test_id":"TLC-FC-23-MEMORY-008-AT-002","applies_to":"ASSESS-MEMORY-008","category":"preservation","given":"The hereditary system uses K1 and K2 while the theorem states K.","when":"Assessment runs.","expect":"The mismatch remains unresolved rather than mapped automatically.","source_basis":["registry/test-plans/TLC-FC-23-MEMORY-008/test-plan.yaml"]},{"test_id":"TLC-FC-23-MEMORY-008-AT-003","applies_to":"ASSESS-MEMORY-008","category":"invalid_input","given":"A caller requests stable=true or unique X_star from the incomplete assumptions.","when":"Certification is requested.","expect":"StabilityCertificationUnsupported.","source_basis":["registry/oracles/memory/TLC-FC-23-MEMORY-008/oracle.yaml"]}]}
