{"schema_version":"1.0","package_version":"1.0.0","applies_to":"TLC-FC-26-IDENTITY-003","tests":[{"test_id":"IDENTITY-003-A01","applies_to":"TLC-FC-26-IDENTITY-003","category":"output_contract","given":"Phi_id and a supplied Phi_seuil","when":"the assessment is evaluated","expect":"strict less-than is healthy strict greater-than is exceeded and equality is boundary"},{"test_id":"IDENTITY-003-A02","applies_to":"TLC-FC-26-IDENTITY-003","category":"error","given":"Phi_seuil is missing","when":"execution is requested","expect":"IdentityThresholdRequired"},{"test_id":"IDENTITY-003-A03","applies_to":"TLC-FC-26-IDENTITY-003","category":"preservation","given":"an uncalibrated source threshold","when":"the package is implemented","expect":"no default or calibration is introduced"}]}
