{"schema_version":"1.0","package_version":"1.0.0","applies_to":"TLC-FC-19-REGULATION-009","tests":[{"test_id":"REGULATION-009-AT-001","applies_to":"EVALUATE-REGULATION-009","category":"preservation","given":"All source operands are supplied.","when":"dF/dt RHS is evaluated.","expect":"All four source terms are preserved.","source_basis":["registry/oracles/regulation/TLC-FC-19-REGULATION-009/oracle.yaml"]},{"test_id":"REGULATION-009-AT-002","applies_to":"EVALUATE-REGULATION-009","category":"error","given":"dX/dt or grad V is missing.","when":"Evaluation is requested.","expect":"A structured provider error is returned rather than deriving the missing quantity."},{"test_id":"REGULATION-009-AT-003","applies_to":"EVALUATE-REGULATION-009","category":"invariant","given":"The RHS is valid.","when":"The operation returns.","expect":"No ODE integration or matrix-space inference has occurred."}]}
