{"schema_version":"1.0","package_version":"1.0.0","applies_to":"TLC-FC-29-GENERATIONAL-PROPAGATION-025","tests":[{"test_id":"GP025-A01","applies_to":"TLC-FC-29-GENERATIONAL-PROPAGATION-025","category":"unsupported_operation","given":"a request for an operational probability or certificate from the source claim","when":"the theorem boundary is applied","expect":"the request is rejected because the required probabilistic model is not supplied","source_basis":["registry/test-plans/TLC-FC-29-GENERATIONAL-PROPAGATION-025/test-plan.yaml"]}]}