{"schema_version":"1.0","package_version":"1.0.0","applies_to":"TLC-FC-29-GENERATIONAL-PROPAGATION-002","tests":[{"test_id":"GP002-A01","applies_to":"TLC-FC-29-GENERATIONAL-PROPAGATION-002","category":"preservation","given":"the finalized feature contract and supplied evidence","when":"the handoff behavior is evaluated","expect":"the social-validation boundary is preserved and no vote quorum consensus procedure or automatic status transition is invented","source_basis":["registry/test-plans/TLC-FC-29-GENERATIONAL-PROPAGATION-002/test-plan.yaml"]}]}