{"schema_version":"1.0","package_version":"1.0.0","applies_to":"TLC-FC-34-TRANSMISSION-LIFECYCLE-014","tests":[{"test_id":"TRL034014-A01","applies_to":"TLC-FC-34-TRANSMISSION-LIFECYCLE-014","category":"preservation","given":"the authoritative Domain 34 sources and any explicitly declared provider inputs","when":"the feature contract is evaluated","expect":"Expose F_phase(X,M,C,t)+noise-and-correction as an incomplete source relation requiring providers.","source_basis":["registry/test-plans/TLC-FC-34-TRANSMISSION-LIFECYCLE-014/test-plan.yaml"]},{"test_id":"TRL034014-A02","applies_to":"TLC-FC-34-TRANSMISSION-LIFECYCLE-014","category":"error","given":"a request that relies on absent providers, unresolved conventions, invented mappings or invented numerical behavior","when":"an implementation would otherwise fabricate the missing rule","expect":"Do not construct the phase function, stochastic law or correction term from the narrative label.","source_basis":["registry/oracles/transmission-lifecycle/TLC-FC-34-TRANSMISSION-LIFECYCLE-014/oracle.yaml"]}]}
