{"schema_version":"1.0","package_version":"1.0.0","applies_to":"TLC-FC-34-TRANSMISSION-LIFECYCLE-078","tests":[{"test_id":"TRL034078-A01","applies_to":"TLC-FC-34-TRANSMISSION-LIFECYCLE-078","category":"preservation","given":"the authoritative Domain 34 sources and any explicitly declared provider inputs","when":"the feature contract is evaluated","expect":"Preserve the maieutic identity action while recording that its gradient sign is not tied to an oriented cost.","source_basis":["registry/test-plans/TLC-FC-34-TRANSMISSION-LIFECYCLE-078/test-plan.yaml"]},{"test_id":"TRL034078-A02","applies_to":"TLC-FC-34-TRANSMISSION-LIFECYCLE-078","category":"error","given":"a request that relies on absent providers, unresolved conventions, invented mappings or invented numerical behavior","when":"an implementation would otherwise fabricate the missing rule","expect":"Do not select ascent/descent, invent a cost or numerically integrate identity evolution.","source_basis":["registry/oracles/transmission-lifecycle/TLC-FC-34-TRANSMISSION-LIFECYCLE-078/oracle.yaml"]}]}
