{"schema_version":"1.0","package_version":"1.0.0","applies_to":"TLC-FC-26-IDENTITY-001","tests":[{"test_id":"IDENTITY-001-A01","applies_to":"TLC-FC-26-IDENTITY-001","category":"output_contract","given":"Identity source structure","when":"the descriptor is requested","expect":"TLS, TLS-star, Meta(TLS), (X,R), and the product metric are preserved"},{"test_id":"IDENTITY-001-A02","applies_to":"TLC-FC-26-IDENTITY-001","category":"unsupported_operation","given":"a request for concrete isomorphism or Riesz identification","when":"semantic construction is attempted","expect":"IdentitySpaceConstructionUnsupported"},{"test_id":"IDENTITY-001-A03","applies_to":"TLC-FC-26-IDENTITY-001","category":"preservation","given":"the announced T*TLS and J^k(TLS) relation","when":"the package is serialized","expect":"the relation remains an unconstructed scientific claim"}]}
