{
  "schema_version":"1.0","package_version":"1.0.0","applies_to":"TLC-FC-10-VIRTUES-001","tests":[
    {"test_id":"VIRTUES-001-A01","applies_to":"CHECK-APPRENTICESHIP-RESPONSIBILITY","category":"valid_input","given":{"feature_id":"TLC-FC-10-VIRTUES-001","provenance":["TLC-SO-VIRTUES-100"],"artifact":{"roles":"opaque_roles","guidance":"opaque_guidance","context":"opaque_context"}},"when":"The structural handoff is requested.","expect":{"accepted":true,"entrypoint":"check_apprenticeship_responsibility","artifact_unchanged":true},"source_basis":["registry/oracles/virtues/TLC-FC-10-VIRTUES-001/oracle.yaml"]},
    {"test_id":"VIRTUES-001-A02","applies_to":"CHECK-APPRENTICESHIP-RESPONSIBILITY","category":"preservation","given":{"bounded_roles":true,"guided_responsibility":true},"when":"The result is inspected.","expect":{"fields_preserved":true,"interpreted":false},"source_basis":["registry/optimized-ir/virtues/TLC-FC-10-VIRTUES-001/ir.yaml"]},
    {"test_id":"VIRTUES-001-A03","applies_to":"CHECK-APPRENTICESHIP-RESPONSIBILITY","category":"error","given":{"feature_id":"wrong"},"when":"Identity validation runs.","expect":{"source_error_id":"invalid_feature_id","public_error_code":"VIRTUES_INVALID_FEATURE_ID","partial_result":false},"source_basis":["registry/oracles/virtues/TLC-FC-10-VIRTUES-001/oracle.yaml"]},
    {"test_id":"VIRTUES-001-A04","applies_to":"CHECK-APPRENTICESHIP-RESPONSIBILITY","category":"error","given":{"provenance":[]},"when":"Provenance validation runs.","expect":{"source_error_id":"missing_provenance","public_error_code":"VIRTUES_MISSING_PROVENANCE","partial_result":false},"source_basis":["registry/test-plans/TLC-FC-10-VIRTUES-001/test-plan.yaml"]},
    {"test_id":"VIRTUES-001-A05","applies_to":"CHECK-APPRENTICESHIP-RESPONSIBILITY","category":"unsupported_operation","given":{"requested":"moral score"},"when":"The completion guard runs.","expect":{"source_error_id":"unsupported_scientific_completion_request","public_error_code":"VIRTUES_UNSUPPORTED_SCIENTIFIC_COMPLETION_REQUEST","partial_result":false},"source_basis":["registry/oracles/virtues/TLC-FC-10-VIRTUES-001/oracle.yaml"]},
    {"test_id":"VIRTUES-001-A06","applies_to":"CHECK-APPRENTICESHIP-RESPONSIBILITY","category":"determinism","given":{"identical_requests":true},"when":"The operation is repeated.","expect":{"logical_output_identical":true},"source_basis":["registry/oracles/virtues/TLC-FC-10-VIRTUES-001/oracle.yaml"]}
  ]
}