{"schema_version":"1.0","package_version":"1.0.0","applies_to":"TLC-FC-29-GENERATIONAL-PROPAGATION-016","tests":[{"test_id":"GP016-A01","applies_to":"TLC-FC-29-GENERATIONAL-PROPAGATION-016","category":"preservation","given":"supplied before and after corrective measurements","when":"corrective success is evaluated","expect":"both strict source inequalities are required and no correction procedure is synthesized","source_basis":["registry/test-plans/TLC-FC-29-GENERATIONAL-PROPAGATION-016/test-plan.yaml"]}]}