{"schema_version":"1.0","package_version":"1.0.0","applies_to":"TLC-FC-22-TEMPORALITY-007","tests":[{"test_id":"TLC-FC-22-TEMPORALITY-007-AT-001","applies_to":"ASSESS-TEMPORALITY-007","category":"output_contract","given":"All evidence required by multiple source regimes is supplied.","when":"Regime assessment runs.","expect":"Every satisfied source criterion set is returned without precedence.","source_basis":["registry/oracles/temporality/TLC-FC-22-TEMPORALITY-007/oracle.yaml"]},{"test_id":"TLC-FC-22-TEMPORALITY-007-AT-002","applies_to":"ASSESS-TEMPORALITY-007","category":"invalid_input","given":"Required spectral evidence is absent.","when":"A spectral regime assessment is requested.","expect":"ExternalSpectralEvidenceRequired.","source_basis":["registry/oracles/temporality/TLC-FC-22-TEMPORALITY-007/oracle.yaml"]},{"test_id":"TLC-FC-22-TEMPORALITY-007-AT-003","applies_to":"ASSESS-TEMPORALITY-007","category":"preservation","given":"Overlapping satisfied source criteria.","when":"Conformance is assessed.","expect":"No exclusive class or invented precedence is imposed.","source_basis":["registry/test-plans/TLC-FC-22-TEMPORALITY-007/test-plan.yaml"]}]}
