{"schema_version":"1.0","package_version":"1.0.0","applies_to":"TLC-FC-19-REGULATION-012","tests":[{"test_id":"REGULATION-012-AT-001","applies_to":"DESCRIBE-REGULATION-012","category":"preservation","given":"The source theorem statement is read.","when":"The descriptor is built.","expect":"All four conditions, X_mastery claim, and rate-dependency statement are retained.","source_basis":["registry/oracles/regulation/TLC-FC-19-REGULATION-012/oracle.yaml"]},{"test_id":"REGULATION-012-AT-002","applies_to":"DESCRIBE-REGULATION-012","category":"unsupported_operation","given":"No complete proof evidence is supplied.","when":"A convergence certificate is requested.","expect":"The request is non-certifiable rather than guessed."},{"test_id":"REGULATION-012-AT-003","applies_to":"DESCRIBE-REGULATION-012","category":"invariant","given":"External evidence is incomplete.","when":"The descriptor returns.","expect":"No proof threshold expectation estimator or rate estimator is invented."}]}
