{"schema_version":"1.0","package_version":"1.0.0","applies_to":"TLC-FC-31-INSTITUTIONALIZATION-017","tests":[{"test_id":"INS031017-A01","applies_to":"TLC-FC-31-INSTITUTIONALIZATION-017","category":"preservation","given":"the authoritative Institutionalization source and any explicitly declared provider inputs","when":"the feature contract is evaluated","expect":"Preserve phi as a mapping from domain-29 V_t to the domain-31 role set.","source_basis":["registry/test-plans/TLC-FC-31-INSTITUTIONALIZATION-017/test-plan.yaml"]},{"test_id":"INS031017-A02","applies_to":"TLC-FC-31-INSTITUTIONALIZATION-017","category":"error","given":"a request that relies on absent providers, unresolved conventions, or invented science","when":"an implementation would otherwise fabricate the missing rule","expect":"Do not redefine V_t or prescribe assignment order, optimization, priorities or tie-breaking.","source_basis":["registry/oracles/institutionalization/TLC-FC-31-INSTITUTIONALIZATION-017/oracle.yaml"]}]}