{"schema_version":"1.0","package_version":"1.0.0","applies_to":"TLC-FC-17-CASCADE-TRANSMISSION-049","tests":[{"test_id":"CAS017049-A01","applies_to":"TLC-FC-17-CASCADE-TRANSMISSION-049","category":"preservation","given":"the authoritative Cascade Transmission source and any explicitly declared provider inputs","when":"the feature contract is evaluated","expect":"Preserve the p_i differential relation with provider-backed rates/interactions/environment/values terms.","source_basis":["registry/test-plans/TLC-FC-17-CASCADE-TRANSMISSION-049/test-plan.yaml"]},{"test_id":"CAS017049-A02","applies_to":"TLC-FC-17-CASCADE-TRANSMISSION-049","category":"error","given":"a request that relies on absent providers, unresolved conventions, or invented science","when":"an implementation would otherwise fabricate the missing rule","expect":"Do not infer probability-simplex normalization, interaction matrix, solver or parameter values.","source_basis":["registry/oracles/cascade-transmission/TLC-FC-17-CASCADE-TRANSMISSION-049/oracle.yaml"]}]}
