{"schema_version":"1.0","package_version":"1.0.0","applies_to":"TLC-FC-21-FAIRNESS-004","tests":[{"test_id":"FAIR-004-A01","applies_to":"TLC-FC-21-FAIRNESS-004","category":"error","given":"a zero correction denominator","when":"correction is requested","expect":"CorrectionDenominatorZero and no epsilon clamp replacement or NaN policy","source_basis":["registry/test-plans/TLC-FC-21-FAIRNESS-004/test-plan.yaml"]},{"test_id":"FAIR-004-A02","applies_to":"TLC-FC-21-FAIRNESS-004","category":"preservation","given":"complete operands with nonzero denominator","when":"correction is evaluated","expect":"the exact source reciprocal formula is used","source_basis":["registry/test-plans/TLC-FC-21-FAIRNESS-004/test-plan.yaml"]}]}
